{
  "kind": "codec",
  "standard": "Frame and sequence counters: 132.0-B-3 \u00a74.1.2.5-6, 732.0-B-5 \u00a74.1.2.4, 732.1-B-3 \u00a74.1.2.12, 133.0-B-2 \u00a74.1.3.4.3",
  "provenance": "hand-derived",
  "provenance_note": "Classification rule from CMN-031: forward distance 1 in sequence, 0 repeat, 2..=modulus/2 gap (missing = distance - 1), otherwise backwards. Computed with Python big integers.",
  "cases": [
    {
      "id": "counter-inc-1-1",
      "requirements": [
        "CMN-030",
        "GEN-024"
      ],
      "description": "Increment 1 modulo 2^1",
      "operation": "counter_increment",
      "params": {
        "bits": 1,
        "value": 1
      },
      "expect": {
        "ok": true,
        "value": 0
      }
    },
    {
      "id": "counter-inc-8-255",
      "requirements": [
        "CMN-030",
        "GEN-024"
      ],
      "description": "Increment 255 modulo 2^8",
      "operation": "counter_increment",
      "params": {
        "bits": 8,
        "value": 255
      },
      "expect": {
        "ok": true,
        "value": 0
      }
    },
    {
      "id": "counter-inc-8-7",
      "requirements": [
        "CMN-030",
        "GEN-024"
      ],
      "description": "Increment 7 modulo 2^8",
      "operation": "counter_increment",
      "params": {
        "bits": 8,
        "value": 7
      },
      "expect": {
        "ok": true,
        "value": 8
      }
    },
    {
      "id": "counter-inc-14-16383",
      "requirements": [
        "CMN-030",
        "GEN-024"
      ],
      "description": "Increment 16383 modulo 2^14",
      "operation": "counter_increment",
      "params": {
        "bits": 14,
        "value": 16383
      },
      "expect": {
        "ok": true,
        "value": 0
      }
    },
    {
      "id": "counter-inc-24-16777215",
      "requirements": [
        "CMN-030",
        "GEN-024"
      ],
      "description": "Increment 16777215 modulo 2^24",
      "operation": "counter_increment",
      "params": {
        "bits": 24,
        "value": 16777215
      },
      "expect": {
        "ok": true,
        "value": 0
      }
    },
    {
      "id": "counter-inc-56-72057594037927935",
      "requirements": [
        "CMN-030",
        "GEN-024"
      ],
      "description": "Increment 72057594037927935 modulo 2^56",
      "operation": "counter_increment",
      "params": {
        "bits": 56,
        "value": 72057594037927935
      },
      "expect": {
        "ok": true,
        "value": 0
      }
    },
    {
      "id": "counter-inc-64-18446744073709551615",
      "requirements": [
        "CMN-030",
        "GEN-024"
      ],
      "description": "Increment 18446744073709551615 modulo 2^64",
      "operation": "counter_increment",
      "params": {
        "bits": 64,
        "value": 18446744073709551615
      },
      "expect": {
        "ok": true,
        "value": 0
      }
    },
    {
      "id": "counter-classify-8-10-11",
      "requirements": [
        "CMN-030",
        "CMN-031"
      ],
      "description": "next in sequence",
      "operation": "counter_classify",
      "params": {
        "bits": 8,
        "prev": 10,
        "next": 11
      },
      "expect": {
        "ok": true,
        "class": "in-sequence"
      }
    },
    {
      "id": "counter-classify-8-255-0",
      "requirements": [
        "CMN-030",
        "CMN-031"
      ],
      "description": "in sequence across wrap",
      "operation": "counter_classify",
      "params": {
        "bits": 8,
        "prev": 255,
        "next": 0
      },
      "expect": {
        "ok": true,
        "class": "in-sequence"
      }
    },
    {
      "id": "counter-classify-8-10-10",
      "requirements": [
        "CMN-030",
        "CMN-031"
      ],
      "description": "repeat",
      "operation": "counter_classify",
      "params": {
        "bits": 8,
        "prev": 10,
        "next": 10
      },
      "expect": {
        "ok": true,
        "class": "repeat"
      }
    },
    {
      "id": "counter-classify-8-10-13",
      "requirements": [
        "CMN-030",
        "CMN-031"
      ],
      "description": "two missing",
      "operation": "counter_classify",
      "params": {
        "bits": 8,
        "prev": 10,
        "next": 13
      },
      "expect": {
        "ok": true,
        "class": "gap",
        "missing": 2
      }
    },
    {
      "id": "counter-classify-8-250-2",
      "requirements": [
        "CMN-030",
        "CMN-031"
      ],
      "description": "gap across wrap",
      "operation": "counter_classify",
      "params": {
        "bits": 8,
        "prev": 250,
        "next": 2
      },
      "expect": {
        "ok": true,
        "class": "gap",
        "missing": 7
      }
    },
    {
      "id": "counter-classify-8-0-128",
      "requirements": [
        "CMN-030",
        "CMN-031"
      ],
      "description": "gap at exactly modulus/2",
      "operation": "counter_classify",
      "params": {
        "bits": 8,
        "prev": 0,
        "next": 128
      },
      "expect": {
        "ok": true,
        "class": "gap",
        "missing": 127
      }
    },
    {
      "id": "counter-classify-8-0-129",
      "requirements": [
        "CMN-030",
        "CMN-031"
      ],
      "description": "beyond modulus/2 is backwards",
      "operation": "counter_classify",
      "params": {
        "bits": 8,
        "prev": 0,
        "next": 129
      },
      "expect": {
        "ok": true,
        "class": "backwards"
      }
    },
    {
      "id": "counter-classify-8-10-9",
      "requirements": [
        "CMN-030",
        "CMN-031"
      ],
      "description": "one back",
      "operation": "counter_classify",
      "params": {
        "bits": 8,
        "prev": 10,
        "next": 9
      },
      "expect": {
        "ok": true,
        "class": "backwards"
      }
    },
    {
      "id": "counter-classify-1-0-1",
      "requirements": [
        "CMN-030",
        "CMN-031"
      ],
      "description": "1-bit in sequence",
      "operation": "counter_classify",
      "params": {
        "bits": 1,
        "prev": 0,
        "next": 1
      },
      "expect": {
        "ok": true,
        "class": "in-sequence"
      }
    },
    {
      "id": "counter-classify-1-1-1",
      "requirements": [
        "CMN-030",
        "CMN-031"
      ],
      "description": "1-bit repeat",
      "operation": "counter_classify",
      "params": {
        "bits": 1,
        "prev": 1,
        "next": 1
      },
      "expect": {
        "ok": true,
        "class": "repeat"
      }
    },
    {
      "id": "counter-classify-14-16383-0",
      "requirements": [
        "CMN-030",
        "CMN-031"
      ],
      "description": "Space Packet count wraps",
      "operation": "counter_classify",
      "params": {
        "bits": 14,
        "prev": 16383,
        "next": 0
      },
      "expect": {
        "ok": true,
        "class": "in-sequence"
      }
    },
    {
      "id": "counter-classify-14-100-50",
      "requirements": [
        "CMN-030",
        "CMN-031"
      ],
      "description": "Space Packet count backwards",
      "operation": "counter_classify",
      "params": {
        "bits": 14,
        "prev": 100,
        "next": 50
      },
      "expect": {
        "ok": true,
        "class": "backwards"
      }
    },
    {
      "id": "counter-classify-24-16777215-3",
      "requirements": [
        "CMN-030",
        "CMN-031"
      ],
      "description": "AOS VC count gap across wrap",
      "operation": "counter_classify",
      "params": {
        "bits": 24,
        "prev": 16777215,
        "next": 3
      },
      "expect": {
        "ok": true,
        "class": "gap",
        "missing": 3
      }
    },
    {
      "id": "counter-classify-64-18446744073709551615-0",
      "requirements": [
        "CMN-030",
        "CMN-031"
      ],
      "description": "64-bit wrap in sequence",
      "operation": "counter_classify",
      "params": {
        "bits": 64,
        "prev": 18446744073709551615,
        "next": 0
      },
      "expect": {
        "ok": true,
        "class": "in-sequence"
      }
    },
    {
      "id": "counter-classify-64-0-9223372036854775808",
      "requirements": [
        "CMN-030",
        "CMN-031"
      ],
      "description": "64-bit gap at modulus/2",
      "operation": "counter_classify",
      "params": {
        "bits": 64,
        "prev": 0,
        "next": 9223372036854775808
      },
      "expect": {
        "ok": true,
        "class": "gap",
        "missing": 9223372036854775807
      }
    },
    {
      "id": "counter-classify-64-0-9223372036854775809",
      "requirements": [
        "CMN-030",
        "CMN-031"
      ],
      "description": "64-bit backwards",
      "operation": "counter_classify",
      "params": {
        "bits": 64,
        "prev": 0,
        "next": 9223372036854775809
      },
      "expect": {
        "ok": true,
        "class": "backwards"
      }
    },
    {
      "id": "counter-err-0-0",
      "requirements": [
        "CMN-030",
        "GEN-020"
      ],
      "description": "zero-width counter",
      "operation": "counter_increment",
      "params": {
        "bits": 0,
        "value": 0
      },
      "expect": {
        "ok": false,
        "error": "OutOfRange"
      }
    },
    {
      "id": "counter-err-65-0",
      "requirements": [
        "CMN-030",
        "GEN-020"
      ],
      "description": "wider than 64 bits",
      "operation": "counter_increment",
      "params": {
        "bits": 65,
        "value": 0
      },
      "expect": {
        "ok": false,
        "error": "OutOfRange"
      }
    },
    {
      "id": "counter-err-8-256",
      "requirements": [
        "CMN-030",
        "GEN-020"
      ],
      "description": "value exceeds 8 bits",
      "operation": "counter_increment",
      "params": {
        "bits": 8,
        "value": 256
      },
      "expect": {
        "ok": false,
        "error": "OutOfRange"
      }
    }
  ]
}
