{
  "kind": "codec",
  "standard": "132.0-B-3 §4.1.4.6.2 and Annex D; 732.0-B-5 §4.1.4.1.5.2; 732.1-B-3 §4.1.4.1.10",
  "provenance": "blue-book-example",
  "provenance_note": "Sequence printed in 132.0-B-3 Annex D ('Generated data pattern in both cases'). Reproduced by x[n] = x[n-1] ^ x[n-2] ^ x[n-22] ^ x[n-32] with an all-ones seed.",
  "cases": [
    {
      "id": "oid-start-001",
      "requirements": ["CMN-020", "CMN-023"],
      "description": "First 20 octets after device start-up",
      "operation": "oid_fill",
      "params": { "octets": 20 },
      "expect": { "ok": true, "output_hex": "FFFFFFFF6DB6D861451F11F19716723CBE7E00B1" }
    },
    {
      "id": "oid-continuation-001",
      "requirements": ["CMN-021", "CMN-023"],
      "description": "Two fills of 10 octets continue the sequence without restart",
      "operation": "oid_fill_sequence",
      "params": { "fills": [10, 10] },
      "expect": { "ok": true, "outputs_hex": ["FFFFFFFF6DB6D861451F", "11F19716723CBE7E00B1"] }
    }
  ]
}
