{
  "kind": "codec",
  "standard": "133.0-B-2 \u00a74.1, \u00a75",
  "provenance": "hand-derived",
  "provenance_note": "Hand-derived from 133.0-B-2 \u00a74.1 (Figure 4-2, \u00a74.1.3\u20134.1.4), \u00a73.4, and Table 5-1, with the rules of docs/standards/space-packet.md \u00a75 (OI-16, OI-30). 133.0 prints no worked example packets. Expected values computed by an independent Python model of the Blue Book text, written before the Rust codec. Decode outputs list every view field; packet_name is null for telemetry packets.",
  "cases": [
    {
      "id": "spp-idle-001",
      "requirements": [
        "SPP-010"
      ],
      "description": "Total length 7 with the default pattern",
      "operation": "idle",
      "params": {
        "total_len": 7,
        "sequence_count": 0,
        "pattern_hex": "00"
      },
      "expect": {
        "ok": true,
        "output_hex": "07FFC000000000"
      }
    },
    {
      "id": "spp-idle-002",
      "requirements": [
        "SPP-010"
      ],
      "description": "Total length 12, count 9, pattern 0x55",
      "operation": "idle",
      "params": {
        "total_len": 12,
        "sequence_count": 9,
        "pattern_hex": "55"
      },
      "expect": {
        "ok": true,
        "output_hex": "07FFC0090005555555555555"
      }
    },
    {
      "id": "spp-idle-003",
      "requirements": [
        "SPP-010"
      ],
      "description": "Multi-octet pattern repeats and is cut at the end",
      "operation": "idle",
      "params": {
        "total_len": 13,
        "sequence_count": 0,
        "pattern_hex": "DEADBE"
      },
      "expect": {
        "ok": true,
        "output_hex": "07FFC0000006DEADBEDEADBEDE"
      }
    },
    {
      "id": "spp-idle-004",
      "requirements": [
        "SPP-010"
      ],
      "description": "Count 16 383 (largest)",
      "operation": "idle",
      "params": {
        "total_len": 8,
        "sequence_count": 16383,
        "pattern_hex": "FF"
      },
      "expect": {
        "ok": true,
        "output_hex": "07FFFFFF0001FFFF"
      }
    },
    {
      "id": "spp-idle-005",
      "requirements": [
        "SPP-010"
      ],
      "description": "Total length 6 is OutOfRange",
      "operation": "idle",
      "params": {
        "total_len": 6,
        "sequence_count": 0,
        "pattern_hex": "00"
      },
      "expect": {
        "ok": false,
        "error": "OutOfRange"
      }
    },
    {
      "id": "spp-idle-006",
      "requirements": [
        "SPP-010"
      ],
      "description": "Total length above max_packet_len is OutOfRange",
      "operation": "idle",
      "config": {
        "max_packet_len": 100
      },
      "params": {
        "total_len": 101,
        "sequence_count": 0,
        "pattern_hex": "00"
      },
      "expect": {
        "ok": false,
        "error": "OutOfRange"
      }
    },
    {
      "id": "spp-idle-007",
      "requirements": [
        "SPP-010"
      ],
      "description": "Total length equal to max_packet_len",
      "operation": "idle",
      "config": {
        "max_packet_len": 100
      },
      "params": {
        "total_len": 100,
        "sequence_count": 0,
        "pattern_hex": "00"
      },
      "expect": {
        "ok": true,
        "output_hex": "07FFC000005D00000000000000000000000000000000000000000000000000000000000000000000000000000000000000000000000000000000000000000000000000000000000000000000000000000000000000000000000000000000000000000000"
      }
    },
    {
      "id": "spp-idle-008",
      "requirements": [
        "SPP-010"
      ],
      "description": "Empty pattern means the default 0x00",
      "operation": "idle",
      "params": {
        "total_len": 9,
        "sequence_count": 0,
        "pattern_hex": ""
      },
      "expect": {
        "ok": true,
        "output_hex": "07FFC0000002000000"
      }
    }
  ]
}
