{
  "kind": "codec",
  "standard": "732.0-B-5 EC1 §4.1.2.6",
  "provenance": "hand-derived",
  "provenance_note": "Hand-derived from 732.0-B-5 EC1 §4.1.2.6.1 and §4.1.2.6.5 a–h (the same code as 732.0-B-4 §4.1.2.6.5, OI-04, M2 plan D11): RS(15,11) over GF(2^4), F(x) = x^4 + x + 1, g(x) = (x + a^6)(x + a^7)(x + a^8)(x + a^9), five leading symbols of zero virtual fill, systematic; symbols 6–11 are header bits 0–15 and 40–47, symbols 12–15 the FHEC (bits 48–63), each symbol sent from its left bit; bit 0 is the most significant bit of octet 0 (§1.6.3). 732.0 prints no worked FHEC example. Expected values computed by an independent Python model of the Blue Book text, written before the Rust codec: GF(2^4) by carry-less multiplication reduced by F(x), with no tables; a codeword is valid when the 15-symbol polynomial vanishes at a^6…a^9; the parity is solved by GF(2) linear algebra on those syndromes, not by division by g(x); decoding is a table from the syndrome of each of the 10 275 patterns of one or two symbol errors over the ten transmitted symbols to the pattern. The Rust codec divides by g(x) and decodes algebraically (Peterson, root search, Forney), so the two share no method. Input and output are the eight octets of the primary header with FHEC; octets 2–4 (the Virtual Channel Frame Count) are not protected. ",
  "cases": [
    {
      "id": "aos-fhec-c1-000",
      "requirements": [
        "AOS-013",
        "AOS-014"
      ],
      "description": "Codeword: no correction",
      "operation": "fhec_decode",
      "input_hex": "4001000000003EDF",
      "expect": {
        "ok": true,
        "header_hex": "4001000000003EDF",
        "corrected_symbols": 0
      }
    },
    {
      "id": "aos-fhec-c1-001",
      "requirements": [
        "AOS-013",
        "AOS-014"
      ],
      "description": "Symbol 6 (systematic) received with error 0001; corrected",
      "operation": "fhec_decode",
      "input_hex": "5001000000003EDF",
      "expect": {
        "ok": true,
        "header_hex": "4001000000003EDF",
        "corrected_symbols": 1
      }
    },
    {
      "id": "aos-fhec-c1-002",
      "requirements": [
        "AOS-013",
        "AOS-014"
      ],
      "description": "Symbol 7 (systematic) received with error 1000; corrected",
      "operation": "fhec_decode",
      "input_hex": "4801000000003EDF",
      "expect": {
        "ok": true,
        "header_hex": "4001000000003EDF",
        "corrected_symbols": 1
      }
    },
    {
      "id": "aos-fhec-c1-003",
      "requirements": [
        "AOS-013",
        "AOS-014"
      ],
      "description": "Symbol 8 (systematic) received with error 1111; corrected",
      "operation": "fhec_decode",
      "input_hex": "40F1000000003EDF",
      "expect": {
        "ok": true,
        "header_hex": "4001000000003EDF",
        "corrected_symbols": 1
      }
    },
    {
      "id": "aos-fhec-c1-004",
      "requirements": [
        "AOS-013",
        "AOS-014"
      ],
      "description": "Symbol 9 (systematic) received with error 0110; corrected",
      "operation": "fhec_decode",
      "input_hex": "4007000000003EDF",
      "expect": {
        "ok": true,
        "header_hex": "4001000000003EDF",
        "corrected_symbols": 1
      }
    },
    {
      "id": "aos-fhec-c1-005",
      "requirements": [
        "AOS-013",
        "AOS-014"
      ],
      "description": "Symbol 10 (systematic) received with error 0011; corrected",
      "operation": "fhec_decode",
      "input_hex": "4001000000303EDF",
      "expect": {
        "ok": true,
        "header_hex": "4001000000003EDF",
        "corrected_symbols": 1
      }
    },
    {
      "id": "aos-fhec-c1-006",
      "requirements": [
        "AOS-013",
        "AOS-014"
      ],
      "description": "Symbol 11 (systematic) received with error 1010; corrected",
      "operation": "fhec_decode",
      "input_hex": "40010000000A3EDF",
      "expect": {
        "ok": true,
        "header_hex": "4001000000003EDF",
        "corrected_symbols": 1
      }
    },
    {
      "id": "aos-fhec-c1-007",
      "requirements": [
        "AOS-013",
        "AOS-014"
      ],
      "description": "Symbol 12 (parity (FHEC)) received with error 0101; corrected",
      "operation": "fhec_decode",
      "input_hex": "4001000000006EDF",
      "expect": {
        "ok": true,
        "header_hex": "4001000000003EDF",
        "corrected_symbols": 1
      }
    },
    {
      "id": "aos-fhec-c1-008",
      "requirements": [
        "AOS-013",
        "AOS-014"
      ],
      "description": "Symbol 13 (parity (FHEC)) received with error 1100; corrected",
      "operation": "fhec_decode",
      "input_hex": "40010000000032DF",
      "expect": {
        "ok": true,
        "header_hex": "4001000000003EDF",
        "corrected_symbols": 1
      }
    },
    {
      "id": "aos-fhec-c1-009",
      "requirements": [
        "AOS-013",
        "AOS-014"
      ],
      "description": "Symbol 14 (parity (FHEC)) received with error 1001; corrected",
      "operation": "fhec_decode",
      "input_hex": "4001000000003E4F",
      "expect": {
        "ok": true,
        "header_hex": "4001000000003EDF",
        "corrected_symbols": 1
      }
    },
    {
      "id": "aos-fhec-c1-010",
      "requirements": [
        "AOS-013",
        "AOS-014"
      ],
      "description": "Symbol 15 (parity (FHEC)) received with error 0111; corrected",
      "operation": "fhec_decode",
      "input_hex": "4001000000003ED8",
      "expect": {
        "ok": true,
        "header_hex": "4001000000003EDF",
        "corrected_symbols": 1
      }
    },
    {
      "id": "aos-fhec-c1-011",
      "requirements": [
        "AOS-013",
        "AOS-014"
      ],
      "description": "VCID nibble all wrong in a header with a non-zero frame count; octets 2–4 unchanged",
      "operation": "fhec_decode",
      "input_hex": "6A8A123456001252",
      "expect": {
        "ok": true,
        "header_hex": "6A85123456001252",
        "corrected_symbols": 1
      }
    },
    {
      "id": "aos-fhec-c1-012",
      "requirements": [
        "AOS-013",
        "AOS-014"
      ],
      "description": "One cycle-field symbol wrong and the frame count octet 3 flipped: the symbol is corrected, the frame count is passed on unaltered",
      "operation": "fhec_decode",
      "input_hex": "6A8512CB56021252",
      "expect": {
        "ok": true,
        "header_hex": "6A8512CB56001252",
        "corrected_symbols": 1
      }
    },
    {
      "id": "aos-fhec-c1-013",
      "requirements": [
        "AOS-013",
        "AOS-014"
      ],
      "description": "Frame count octets changed only: not covered, no correction, octets passed on",
      "operation": "fhec_decode",
      "input_hex": "6A85ED3457001252",
      "expect": {
        "ok": true,
        "header_hex": "6A85ED3457001252",
        "corrected_symbols": 0
      }
    }
  ]
}
